id,first_name,last_name,check,odds,age,country,height,birthplace,education,overview,wins,residence,instagram,twitter,best_finish,best_finish_position,best_finish_group,money_earned,avg_round,low_round,high_round,rounds_under_par,rounds_under_par_percentage,turned_pro,amateur,past_masters,tournaments_played,cuts_made,cuts_made_percentage,,rounds_played,country_name,display_name,name,sort_name,weight,swing,past_champion,first_masters,international,masters_wins,real_player,dq,wd,share_url,image,best_finish_position_norm,money_earned_norm,avg_round_norm,tournaments_played_norm,masters_wins_norm,rounds_under_par_percentage_norm,cuts_made_percentage_norm
51349,Nicolas,Echavarria,1,225,32,Colombia,"6'0""","Medellin, Colombia",University of Arkansas,"Nicolas Echavarria is making his second Masters start in 2026. Before he made his Tournament debut in 2025, he won the Par 3 Contest. In March, he won in Palm Beach Gardens by two strokes over three players after closing with consecutive bogey-free rounds of 66 to earn his third career PGA Tour victory. He also finished T-8 in the AT&T Pebble Beach Pro-Am in February. In 2025, he had four top-10 finishes worldwide, including runner-up in Honolulu and T-4 in St. Simons Island. He earned his first two PGA Tour wins in Puerto Rico in 2023 and Japan in 2024. Before turning professional, he recorded top-20 finishes in each of the first three editions of the Latin America Amateur Championship.",3,"Ponte Vedra Beach, Florida",@nicolas_ech,@nicolas_ech,51 (2025),51,Top 75,"51,660",74,69,84,2,0.5,2017,,"Year: 2025, Position: 51, Total: 296, R1: 73, R2: 70, R3: 69, R4: 84 | ",1,1,1.00,,4,Colombia,N. Echavarria,Nicolas Echavarria,echavarria,165,Right,FALSE,FALSE,TRUE,0,TRUE,FALSE,FALSE,https://www.masters.com/en_US/players/player_51349.html,FALSE,0.324,0.005,0.45,0.025,0,0.667,1
34099,Harris,English,1,100,36,United States,"6'3""","Valdosta, Georgia",University of Georgia,"Harris English is making his seventh Masters start in 2026. He shot a final-round 68 last year to record both his lowest round and highest finish at Augusta National. He went on to finish runner-up in both the PGA Championship at Quail Hollow and The Open at Royal Portrush, compete in his first Tour Championship since 2021 and represent the United States in the Ryder Cup later in 2025. He also finished inside the top eight in the U.S. Open in 2020, 2021 and 2023. Before turning professional, he was a four-time All-American at the University of Georgia and represented the United States in the Walker Cup.",5,"Sea Island, Georgia",@harris_english,@Harris_English,T-12 (2025),12,Top 25,"870,700",73.05,68,77,7,0.318181818,2011,,"Year: 2014, Position: MC, Total: 150, R1: 74, R2: 76, R3: 0, R4: 0 | Year: 2016, Position: T42, Total: 299, R1: 74, R2: 73, R3: 76, R4: 76 | Year: 2021, Position: T21, Total: 288, R1: 74, R2: 71, R3: 73, R4: 70 | Year: 2023, Position: T43, Total: 294, R1: 71, R2: 71, R3: 77, R4: 75 | Year: 2024, Position: T22, Total: 292, R1: 72, R2: 74, R3: 75, R4: 71 | Year: 2025, Position: T12, Total: 284, R1: 70, R2: 73, R3: 73, R4: 68 | ",6,5,0.83,,22,United States,H. English,Harris English,english,185,Right,FALSE,FALSE,FALSE,0,TRUE,FALSE,FALSE,https://www.masters.com/en_US/players/player_34099.html,FALSE,0.851,0.088,0.592,0.15,0,0.424,0.833
68932,Ethan,Fang,1,1000,20,United States,"6'0""","Plano, Texas",Oklahoma State University,"Ethan Fang is making his first Masters start in 2026. Last June, he won the Amateur Championship at Royal St George's in England by defeating Ireland's Gavin Tiernan in the final, 1 up. With his victory, he joined Bobby Jones, José María Olazábal and Sergio García as winners of that title. Also last year, the First Team All-American at Oklahoma State University helped his team win the NCAA Division I Men's Golf Championship, finished runner-up in the Western Amateur, competed in The Open at Royal Portrush in Northern Ireland and represented the United States in the Arnold Palmer Cup, Walker Cup and Eisenhower Trophy.",0,"Plano, Texas",@ethanfang2,,,75,Rookie,0,0,,,,0,,1,,0,,0.00,,,United States,E. Fang,Ethan Fang,fang,,Right,FALSE,TRUE,FALSE,0,TRUE,FALSE,FALSE,https://www.masters.com/en_US/players/player_68932.html,FALSE,0,0,0,0,0,0,0
40098,Matt,Fitzpatrick,1,22,31,England,"5'10""","Sheffield, England",Northwestern University,"Matt Fitzpatrick is making his 12th Masters start in 2026. In March in consecutive weeks, he finished runner-up in the Players Championship and earned his third career PGA Tour win in Tampa. In 2025, he won the DP World Tour's season-ending event in Dubai and his other high worldwide finishes included T-4 in both the Scottish Open and The Open and T-8 in the PGA Championship. He was also part of his fourth European Ryder Cup team last year. He won both the 2013 U.S. Amateur and 2022 U.S. Open at The Country Club in Brookline, Massachusetts. Before turning professional, he also won the 2012 R&A Boys' Amateur, spent 21 weeks as No. 1 in the World Amateur Golf Rankings and represented Great Britain & Ireland in the Walker Cup.",2,"Sheffield, England",@mattfitz94,@MattFitz94,T-7 (2016),7,Top 10,"1,549,391",72.36,67,78,16,0.380952381,2014,,"Year: 2014, Position: MC, Total: 149, R1: 76, R2: 73, R3: 0, R4: 0 | Year: 2016, Position: T7, Total: 288, R1: 71, R2: 76, R3: 74, R4: 67 | Year: 2017, Position: 32, Total: 292, R1: 71, R2: 78, R3: 73, R4: 70 | Year: 2018, Position: T38, Total: 291, R1: 75, R2: 74, R3: 67, R4: 75 | Year: 2019, Position: T21, Total: 283, R1: 78, R2: 67, R3: 68, R4: 70 | Year: 2020, Position: T46, Total: 289, R1: 74, R2: 70, R3: 73, R4: 72 | Year: 2021, Position: T34, Total: 290, R1: 74, R2: 70, R3: 73, R4: 73 | Year: 2022, Position: T14, Total: 290, R1: 71, R2: 73, R3: 76, R4: 70 | Year: 2023, Position: T10, Total: 284, R1: 70, R2: 72, R3: 72, R4: 70 | Year: 2024, Position: T22, Total: 292, R1: 71, R2: 73, R3: 73, R4: 75 | Year: 2025, Position: T40, Total: 291, R1: 71, R2: 73, R3: 74, R4: 73 | ",11,10,0.91,,42,England,M. Fitzpatrick,Matt Fitzpatrick,fitzpatrick,155,Right,FALSE,FALSE,TRUE,0,TRUE,FALSE,FALSE,https://www.masters.com/en_US/players/player_40098.html,FALSE,0.919,0.157,0.696,0.275,0,0.508,0.909
30911,Tommy,Fleetwood,1,25,35,England,"5'11""","Southport, England",,"Tommy Fleetwood is making his 10th Masters start in 2026. He has finished inside the top 25 in five of the past eight years at Augusta National. He won last year's Tour Championship at East Lake to both earn his first career PGA Tour victory and win the season-long title. In the two months before his victory, he finished runner-up in Hartford, T-3 in Memphis and T-4 in Maryland. He went on to represent Europe in his fourth Ryder Cup and win a DP World Tour event in India later in 2025. Before turning professional, the 2024 Olympic silver medalist for Great Britain was runner-up in the 2008 Amateur Championship and represented Great Britain & Ireland in the 2009 Walker Cup.",1,"Southport, England",@officialtommyfleetwood,@TommyFleetwood1,T-3 (2024),3,Top 10,"2,000,749",72,66,78,14,0.411764706,2010,,"Year: 2017, Position: MC, Total: 152, R1: 78, R2: 74, R3: 0, R4: 0 | Year: 2018, Position: T17, Total: 284, R1: 72, R2: 72, R3: 66, R4: 74 | Year: 2019, Position: T36, Total: 286, R1: 71, R2: 71, R3: 70, R4: 74 | Year: 2020, Position: T19, Total: 282, R1: 71, R2: 66, R3: 71, R4: 74 | Year: 2021, Position: T46, Total: 293, R1: 74, R2: 70, R3: 73, R4: 76 | Year: 2022, Position: T14, Total: 290, R1: 75, R2: 72, R3: 70, R4: 73 | Year: 2023, Position: 33, Total: 291, R1: 72, R2: 71, R3: 74, R4: 74 | Year: 2024, Position: T3, Total: 284, R1: 72, R2: 71, R3: 72, R4: 69 | Year: 2025, Position: T21, Total: 286, R1: 73, R2: 69, R3: 75, R4: 69 | ",9,8,0.89,,34,England,T. Fleetwood,Tommy Fleetwood,fleetwood,168,Right,FALSE,FALSE,TRUE,0,TRUE,FALSE,FALSE,https://www.masters.com/en_US/players/player_30911.html,FALSE,0.973,0.203,0.75,0.225,0,0.549,0.889
29936,Ryan,Fox,1,150,39,New Zealand,"6'0""","Auckland, New Zealand",,"Ryan Fox is making his third Masters start in 2026 and first since 2024. In 2025, he won in Myrtle Beach in May to earn his first career PGA Tour win and then won the Canadian Open in June to earn his second victory. His wins on the DP World Tour include victories in St Andrews in 2022 and that organization's flagship event in England in 2023. He has represented New Zealand in the Olympics three times in 2016, 2021 and 2024. Before turning professional, he competed in the first three editions of the Asia-Pacific Amateur Championship in 2009-2011 and represented his country in the 2010 Eisenhower Trophy.",2,"Auckland, New Zealand",@ryanfoxgolfer,@ryanfoxgolfer,T-26 (2023),26,Top 50,"233,000",72.88,69,77,3,0.375,2011,,"Year: 2023, Position: T26, Total: 288, R1: 70, R2: 71, R3: 74, R4: 73 | Year: 2024, Position: T38, Total: 295, R1: 69, R2: 74, R3: 77, R4: 75 | ",2,2,1.00,,8,New Zealand,R. Fox,Ryan Fox,fox,220,Right,FALSE,FALSE,TRUE,0,TRUE,FALSE,FALSE,https://www.masters.com/en_US/players/player_29936.html,FALSE,0.662,0.024,0.618,0.05,0,0.5,1
21209,Sergio,García,1,200,46,Spain,"5'10""","Borriol, Spain",,"Sergio García is making his 27th Masters start in 2026. He won the 2017 Masters in a playoff over Justin Rose to follow Seve Ballesteros and José María Olazábal as Spaniards to win at Augusta National. In his Tournament debut in 1999 at the age of 19, he earned Low Amateur honors as Olazábal won the second of his two Masters titles. He is one of seven Low Amateurs to win a Green Jacket, with Cary Middlecoff, Jack Nicklaus, Ben Crenshaw, Tiger Woods, Phil Mickelson and Hideki Matsuyama. Earlier this year, he recorded top-10 finishes in Bahrain and Hong Kong. Other highlights of his career before turning professional include winning both the 1997 R&A Boys' Amateur and 1998 Amateur Championship and representing Spain in the Eisenhower Trophy.",11,"Austin, Texas",@thesergiogarcia,@TheSergioGarcia,1 (2017),1,Winner,"3,476,530",73.13,66,81,25,0.304878049,1999,,"Year: 1999, Position: T38, Total: 295, R1: 72, R2: 75, R3: 75, R4: 73 | Year: 2000, Position: T40, Total: 295, R1: 70, R2: 72, R3: 75, R4: 78 | Year: 2001, Position: MC, Total: 146, R1: 70, R2: 76, R3: 0, R4: 0 | Year: 2002, Position: 8, Total: 284, R1: 68, R2: 71, R3: 70, R4: 75 | Year: 2003, Position: T28, Total: 294, R1: 69, R2: 78, R3: 74, R4: 73 | Year: 2004, Position: T4, Total: 285, R1: 72, R2: 72, R3: 75, R4: 66 | Year: 2005, Position: MC, Total: 149, R1: 77, R2: 72, R3: 0, R4: 0 | Year: 2006, Position: 46, Total: 298, R1: 72, R2: 74, R3: 79, R4: 73 | Year: 2007, Position: MC, Total: 154, R1: 76, R2: 78, R3: 0, R4: 0 | Year: 2008, Position: MC, Total: 148, R1: 76, R2: 72, R3: 0, R4: 0 | Year: 2009, Position: T38, Total: 289, R1: 73, R2: 67, R3: 75, R4: 74 | Year: 2010, Position: T45, Total: 298, R1: 74, R2: 70, R3: 76, R4: 78 | Year: 2011, Position: T35, Total: 288, R1: 69, R2: 71, R3: 75, R4: 73 | Year: 2012, Position: T12, Total: 286, R1: 72, R2: 68, R3: 75, R4: 71 | Year: 2013, Position: T8, Total: 285, R1: 66, R2: 76, R3: 73, R4: 70 | Year: 2014, Position: MC, Total: 149, R1: 74, R2: 75, R3: 0, R4: 0 | Year: 2015, Position: T17, Total: 283, R1: 68, R2: 74, R3: 71, R4: 70 | Year: 2016, Position: T34, Total: 296, R1: 69, R2: 75, R3: 81, R4: 71 | Year: 2017, Position: 1, Total: 279, R1: 71, R2: 69, R3: 70, R4: 69 | Year: 2018, Position: MC, Total: 159, R1: 81, R2: 78, R3: 0, R4: 0 | Year: 2019, Position: MC, Total: 148, R1: 73, R2: 75, R3: 0, R4: 0 | Year: 2021, Position: MC, Total: 148, R1: 76, R2: 72, R3: 0, R4: 0 | Year: 2022, Position: T23, Total: 291, R1: 72, R2: 74, R3: 74, R4: 71 | Year: 2023, Position: MC, Total: 151, R1: 74, R2: 77, R3: 0, R4: 0 | Year: 2024, Position: MC, Total: 151, R1: 72, R2: 79, R3: 0, R4: 0 | Year: 2025, Position: MC, Total: 148, R1: 72, R2: 76, R3: 0, R4: 0 | ",26,15,0.58,,82,Spain,S. García,Sergio García,garcía,180,Right,TRUE,FALSE,TRUE,1,TRUE,FALSE,FALSE,https://www.masters.com/en_US/players/player_21209.html,FALSE,1,0.352,0.58,0.65,0.333,0.407,0.577
59018,Ryan,Gerard,1,175,26,United States,"6'2""","Raleigh, North Carolina",University of North Carolina,"Ryan Gerard is making his first Masters start in 2026. He finished second in Honolulu and La Quinta in January and in December, he was runner-up in Mauritius to end 2025 inside the top 50 in the Official World Golf Ranking and earn his first Tournament invitation. Also last year, he won in California in July and was second in San Antonio and T-8 in his PGA Championship debut. In 2024, he won a Korn Ferry Tour event in South Carolina on his way to earning his PGA Tour card for the following season. Before turning professional, he was a two-time All-American at the University of North Carolina.",1,"Jupiter, Florida",@golfgerard,,,75,Rookie,0,0,,,,0,2022,,,0,,0.00,,,United States,R. Gerard,Ryan Gerard,gerard,175,Right,FALSE,TRUE,FALSE,0,TRUE,FALSE,FALSE,https://www.masters.com/en_US/players/player_59018.html,FALSE,0,0,0,0,0,0,0
59095,Chris,Gotterup,1,50,26,United States,"6'0""","Easton, Maryland",Rutgers University/University of Oklahoma,"Chris Gotterup is making his first Masters start in 2026. He will join Dave Hill in 1968 and Mark Wilson in 2011 as players since World War II to make their Masters debut with at least four official PGA Tour wins. Since July 2025, he has won the Scottish Open, finished third in The Open at Royal Portrush, competed in his first Tour Championship and started the 2026 season with victories in Honolulu and Phoenix. After earning his PGA Tour card through the Korn Ferry Tour in 2023, he won in Myrtle Beach in 2024. Before turning professional, he competed for four years at Rutgers University in New Jersey and, in his fifth collegiate season for the University of Oklahoma in 2022, he won both the Fred Haskins and Jack Nicklaus Awards.",4,"Edmond, Oklahoma",@chrisgotterup,@ChrisGotterup,,75,Rookie,0,0,,,,0,2022,,,0,,0.00,,,United States,C. Gotterup,Chris Gotterup,gotterup,210,Right,FALSE,TRUE,FALSE,0,TRUE,FALSE,FALSE,https://www.masters.com/en_US/players/player_59095.html,FALSE,0,0,0,0,0,0,0
51977,Max,Greyserman,1,200,30,United States,"5'10""","Short Hills, New Jersey",Duke University,"Max Greyserman is making his second Masters start in 2026. In 2025, he recorded multiple runner-up performances on the PGA Tour for the second consecutive year. He was second in Detroit and Japan and also finished T-7 in La Quinta, T-11 in Palm Beach Gardens and T-23 in the U.S. Open at Oakmont last year. In 2024, he was runner-up three times in Minnesota, Greensboro and Japan and also finished fourth in New Orleans and Mexico and T-7 in Houston. He earned his first PGA Tour card through his performance on the Korn Ferry Tour in 2023. Before turning professional, he played collegiate golf at Duke University.",0,"Palm Beach Gardens, Florida",@maxgreyserman,@maxgreyserman,T-32 (2025),32,Top 50,"121,538",72.25,69,75,2,0.5,2017,,"Year: 2025, Position: T32, Total: 289, R1: 71, R2: 75, R3: 69, R4: 74 | ",1,1,1.00,,4,United States,M. Greyserman,Max Greyserman,greyserman,180,Right,FALSE,FALSE,FALSE,0,TRUE,FALSE,FALSE,https://www.masters.com/en_US/players/player_51977.html,FALSE,0.581,0.012,0.712,0.025,0,0.667,1
54591,Ben,Griffin,1,125,29,United States,"6'1""","Chapel Hill, North Carolina",University of North Carolina,"Ben Griffin is making his first Masters start in 2026. He won a team event with Andrew Novak in New Orleans in April and then won in Fort Worth in May and Mexico in November for his first three victories on the PGA Tour. He also finished runner-up in the Memorial Tournament and in Napa, recorded top-10 finishes in both the U.S. Open and the PGA Championship, competed in his first Tour Championship at East Lake and represented the United States on his first Ryder Cup team last year. Before turning professional, he was a two-time All-American at the University of North Carolina, Chapel Hill.",3,"Jupiter, Florida",@bengriffingolf,@bengriffingolf,,75,Rookie,0,0,,,,0,2018,,,0,,0.00,,,United States,B. Griffin,Ben Griffin,griffin,185,Right,FALSE,TRUE,FALSE,0,TRUE,FALSE,FALSE,https://www.masters.com/en_US/players/player_54591.html,FALSE,0,0,0,0,0,0,0
57975,Harry,Hall,1,350,28,England,"6'4""","Camborne, England","University of Nevada, Las Vegas","Harry Hall is making his first Masters start in 2026. Earlier this year, he finished T-6 in Honolulu and T-9 in the Arnold Palmer Invitational in Orlando. He competed in his first Tour Championship at East Lake in 2025 after recording top-25 finishes in more than half of his PGA Tour starts last season, including sixth-place performances in Fort Worth and Maryland. He won in Kentucky in 2024 to earn his first career win on both the PGA Tour and DP World Tour. Before turning professional, he played collegiate golf at the University of Nevada, Las Vegas and represented his country in both the Arnold Palmer Cup and the Walker Cup.",1,"Las Vegas, Nevada",@harryhall,@HarryHall,,75,Rookie,0,0,,,,0,2019,,,0,,0.00,,,England,H. Hall,Harry Hall,hall,225,Right,FALSE,TRUE,TRUE,0,TRUE,FALSE,FALSE,https://www.masters.com/en_US/players/player_57975.html,FALSE,0,0,0,0,0,0,0
27644,Brian,Harman,1,125,39,United States,"5'7""","Savannah, Georgia",University of Georgia,"Brian Harman is making his eighth Masters start in 2026. He competed in the Tour Championship in 2025 for the third time in the past four years after winning in San Antonio and finishing T-3 in Hilton Head Island, eighth in Hartford and T-10 in The Open at Royal Portrush. After winning The Open in 2023 at Royal Liverpool, he went on to represent the United States in both the 2023 Ryder Cup and 2024 Presidents Cup. Before turning professional, he won the 2003 U.S. Junior Amateur, was a three-time All-American at the University of Georgia and represented his country in two Arnold Palmer Cups and two Walker Cups.",4,"St. Simons Island, Georgia",@harmanbrian,@harmanbrian,T-12 (2021),12,Top 25,"399,763",73.45,69,81,6,0.3,2009,,"Year: 2015, Position: MC, Total: 148, R1: 76, R2: 72, R3: 0, R4: 0 | Year: 2018, Position: T44, Total: 292, R1: 73, R2: 74, R3: 76, R4: 69 | Year: 2021, Position: T12, Total: 286, R1: 69, R2: 69, R3: 74, R4: 74 | Year: 2022, Position: MC, Total: 149, R1: 74, R2: 75, R3: 0, R4: 0 | Year: 2023, Position: MC, Total: 151, R1: 77, R2: 74, R3: 0, R4: 0 | Year: 2024, Position: MC, Total: 153, R1: 81, R2: 72, R3: 0, R4: 0 | Year: 2025, Position: T36, Total: 290, R1: 71, R2: 71, R3: 77, R4: 71 | ",7,3,0.43,,20,United States,B. Harman,Brian Harman,harman,150,Left,FALSE,FALSE,FALSE,0,TRUE,FALSE,FALSE,https://www.masters.com/en_US/players/player_27644.html,FALSE,0.851,0.041,0.532,0.175,0,0.4,0.429
34363,Tyrrell,Hatton,1,66,34,England,"5'9""","High Wycombe, England",,"Tyrrell Hatton is making his 10th Masters start in 2026. He has finished inside the top 15 at Augusta National in each of the past two years. In February, he finished T-3 in Australia. After starting 2025 with a win in Dubai, he went on to finish runner-up in St Andrews, record top-five performances in both the U.S. Open and the DP World Tour's flagship event in England and represent Europe in his fourth Ryder Cup last year. Other worldwide wins include the 2017 Italian Open, both the Arnold Palmer Invitational and DP World Tour's flagship event in 2020 and three DP World Tour victories in St Andrews.",1,"Marlow, England",@tyrrellhatton,@TyrrellHatton,T-9 (2024),9,Top 10,"1,252,310",73.31,68,80,8,0.25,2011,,"Year: 2017, Position: MC, Total: 158, R1: 80, R2: 78, R3: 0, R4: 0 | Year: 2018, Position: T44, Total: 292, R1: 74, R2: 75, R3: 73, R4: 70 | Year: 2019, Position: T56, Total: 292, R1: 73, R2: 73, R3: 72, R4: 74 | Year: 2020, Position: MC, Total: 147, R1: 73, R2: 74, R3: 0, R4: 0 | Year: 2021, Position: T18, Total: 287, R1: 71, R2: 74, R3: 74, R4: 68 | Year: 2022, Position: 52, Total: 305, R1: 72, R2: 74, R3: 79, R4: 80 | Year: 2023, Position: T34, Total: 292, R1: 71, R2: 73, R3: 72, R4: 76 | Year: 2024, Position: T9, Total: 288, R1: 72, R2: 74, R3: 73, R4: 69 | Year: 2025, Position: T14, Total: 285, R1: 69, R2: 70, R3: 75, R4: 71 | ",9,7,0.78,,32,England,T. Hatton,Tyrrell Hatton,hatton,161,Right,FALSE,FALSE,TRUE,0,TRUE,FALSE,FALSE,https://www.masters.com/en_US/players/player_34363.html,FALSE,0.892,0.127,0.553,0.225,0,0.333,0.778
34098,Russell,Henley,1,50,36,United States,"6'0""","Macon, Georgia",University of Georgia,"Russell Henley is making his 10th Masters start in 2026. He finished T-6 in the Arnold Palmer Invitational in March as defending champion and T-8 in La Quinta in January. In the past two years, he has finished inside the top four in the Tour Championship twice, recorded top-10 performances in both the U.S. Open and The Open twice and represented the United States in the Presidents Cup in 2024 and the Ryder Cup in 2025. Before turning professional, he was a four-time All-American at the University of Georgia and represented his country in both the Arnold Palmer Cup and Walker Cup.",5,"Columbus, Georgia",@russhenleygolf,@russhenleygolf,T-4 (2023),4,Top 10,"1,559,650",72.41,67,81,14,0.4375,2011,,"Year: 2013, Position: MC, Total: 153, R1: 72, R2: 81, R3: 0, R4: 0 | Year: 2014, Position: T31, Total: 293, R1: 73, R2: 70, R3: 75, R4: 75 | Year: 2015, Position: 21, Total: 285, R1: 68, R2: 74, R3: 72, R4: 71 | Year: 2017, Position: T11, Total: 287, R1: 71, R2: 76, R3: 71, R4: 69 | Year: 2018, Position: T15, Total: 283, R1: 73, R2: 72, R3: 71, R4: 67 | Year: 2022, Position: T30, Total: 293, R1: 73, R2: 74, R3: 76, R4: 70 | Year: 2023, Position: T4, Total: 281, R1: 73, R2: 67, R3: 71, R4: 70 | Year: 2024, Position: T38, Total: 295, R1: 73, R2: 77, R3: 74, R4: 71 | Year: 2025, Position: MC, Total: 147, R1: 79, R2: 68, R3: 0, R4: 0 | ",9,7,0.78,,32,United States,R. Henley,Russell Henley,henley,180,Right,FALSE,FALSE,FALSE,0,TRUE,FALSE,FALSE,https://www.masters.com/en_US/players/player_34098.html,FALSE,0.959,0.158,0.688,0.225,0,0.583,0.778
70148,Jackson,Herrington,1,1000,19,United States,"6'0""","Nashville, Tennessee",University of Tennessee,"Jackson Herrington is making his first Masters and first major championship start in 2026. Last August, the University of Tennessee sophomore finished runner-up to Mason Howell in the U.S. Amateur at The Olympic Club in California. Notable runners-up in the U.S. Amateur to go on to win Low Amateur honors in the following year's Masters include Ben Crenshaw in 1973, Patrick Cantlay in 2012, Doug Ghim in 2018 and Neal Shipley two years ago. In 2024, he earned Tennessee Men's and Junior Player of the Year honors, finished runner-up with Blades Brown in the U.S. Amateur Four-Ball Championship in Pennsylvania and reached match play in both the U.S. Amateur and Western Amateur.",0,"Dickson, Tennessee",@jackherrington2024,,,75,Rookie,0,0,,,,0,,1,,0,,0.00,,,United States,J. Herrington,Jackson Herrington,herrington,,Left,FALSE,TRUE,FALSE,0,TRUE,FALSE,FALSE,https://www.masters.com/en_US/players/player_70148.html,FALSE,0,0,0,0,0,0,0
52453,Nicolai,Højgaard,2,100,25,Denmark,"6'2""","Billund, Denmark",,"Nicolai Højgaard is making his third Masters start in 2026. He competed in 2025 alongside his brother Rasmus as the first pair of twins to compete in the same Tournament. Both he and his brother have won multiple times on the DP World Tour and they finished second together in a team event in New Orleans last April. In his debut at Augusta National in 2024, he briefly led through 10 holes in the third round before finishing T-16. Earlier this year, he finished runner-up in Houston, T-3 in Phoenix, T-4 in Dubai and T-6 in Palm Beach Gardens. In 2025, he had five top-10 finishes worldwide, including runner-up in England, T-3 in Abu Dhabi and T-4 in the Scottish Open. He has represented his country in the Ryder Cup, Olympics and Eisenhower Trophy.",0,"Aarhus, Denmark",@nicolaihoejgaard,,T-16 (2024),16,Top 25,"335,000",73.33,67,76,1,0.166666667,2019,,"Year: 2024, Position: T16, Total: 290, R1: 67, R2: 73, R3: 74, R4: 76 | Year: 2025, Position: MC, Total: 150, R1: 76, R2: 74, R3: 0, R4: 0 | ",2,1,0.50,,6,Denmark,N. Højgaard,Nicolai Højgaard,hojgaard,193,Right,FALSE,FALSE,TRUE,0,TRUE,FALSE,FALSE,https://www.masters.com/en_US/players/player_52453.html,FALSE,0.797,0.034,0.55,0.05,0,0.222,0.5
52686,Rasmus,Højgaard,2,200,25,Denmark,"6'1""","Billund, Denmark",,"Rasmus Højgaard is making his second Masters start in 2026. He made his debut in 2025 alongside his brother Nicolai as the first pair of twins to compete in the same Tournament. Both have won multiple times on the DP World Tour and they finished second together in a team event in New Orleans last April. He also recorded top-three finishes in Denmark, Switzerland and Mississippi and represented Europe in his first Ryder Cup last year. In 2024, he won the Irish Open and finished runner-up in the DP World Tour's season-ending event in Dubai. Before turning professional, he represented Denmark in the Eisenhower Trophy.",0,"Aarhus, Denmark",@rasmushoejgaard,,T-32 (2025),32,Top 50,"121,538",72.25,67,75,1,0.25,2019,,"Year: 2025, Position: T32, Total: 289, R1: 73, R2: 67, R3: 75, R4: 74 | ",1,1,1.00,,4,Denmark,R. Højgaard,Rasmus Højgaard,hojgaard,187,Right,FALSE,FALSE,TRUE,0,TRUE,FALSE,FALSE,https://www.masters.com/en_US/players/player_52686.html,FALSE,0.581,0.012,0.712,0.025,0,0.333,1
